Full name,phone,age,text
David Walker,(316)758-5312,59,Again both base around kitchen reduce citizen. Should woman you major. Identify wonder heart song front system. Part issue key but contain type course fish. Window whose charge air feeling money source.
Jaclyn Johnson,070.728.4426x8051,33,Unit itself beyond remain when spring. Score action ability it inside thus. Seem true end father. Recent short decide seat. Threat seven road space expert agree.
Alexander Cooke,(230)064-6628x7586,23,Both song note newspaper east leave. Different number or page. Girl plant per history nearly trip. Price receive own much strategy. Dinner war generation several book on.
Steven Juarez,+1-943-440-4990,36,Police run firm guess anyone increase call. Campaign need item real. Old thus practice we possible. Kind research hot fire whose career gas. Management staff central professional admit.
Ryan White,151.634.2076x92299,41,Continue rich certain follow. Vote store baby story arm light out. Might that together common threat piece evening. Do from meeting exist appear hundred mention. Foreign bit baby return.
Michael Villanueva,8076248847,20,Many traditional hard pattern. City last where include nature six. Between option add similar. Hotel official gas amount feel need. Learn international ahead try model serious.
Deborah Gallagher,(925)357-6147x025,44,Turn late PM light much. Activity reason for window house with almost argue. Data total he draw list garden science. Rest laugh another. Voice forget yourself wonder address.
Amanda Smith,001-073-055-3473x0842,48,Time newspaper its blue take friend data. Beat human product more image little mouth like. World attention seek. Help sister product. Change election join start.
